<?xml version="1.0" encoding="UTF-8"?>
<!DOCTYPE resume SYSTEM "dtd_resume.dtd">
<?xml-stylesheet type="text/xsl" href="xsl_resume.xsl" ?>
<resume>
 <lastName>Петрова</lastName>
 <firstName>Світлана</firstName>
 <initials>Іванівна</initials>
 <bday>26 жовтня 1995</bday>
 <edu level="school">
 Запорізька гімназія №71
 </edu>
 <edu level="college">
 Запорізький радіо колледж,
 Телекомунікації
 </edu>
 <edu level="university">
 НУ Запорізька політехніка, Комп’ютерна інженерія
 </edu>
 <edu level="university">
 КНТУ, Захист інформації
 </edu>

 <job>
 <company>Freshcode</company>
 <post>Java Developer</post>
 <start>25 листопада 2015</start>
 <end>8 червня 2018</end>
 </job>
 <job>
 <company>Lagrange-systems</company>
 <post>Java Developer</post>
 <start>20 червня 2018</start>
 <end>15 січня 2020</end>
 </job>

<image href="image1.png">Рисунок</image>

</resume>